{
  "$schema": "../viewer/src/assets/case-study.schema.json",
  "reference": "BC Wallet",
  "url": "https://github.com/openwallet-foundation/bifold-wallet",
  "headline": "Digital Citizenship in Canada",
  "summary": "Lorem ipsum dolor sit amet, consetetur sadipscing elitr, sed diam nonumy eirmod tempor invidunt ut labore et dolore magna aliquyam erat, sed diam voluptua. At vero eos et accusam et justo duo dolores et ea rebum. Stet clita kasd gubergren, no sea takimata sanctus est Lorem ipsum dolor sit amet. Lorem ipsum dolor sit amet, consetetur sadipscing elitr, sed diam nonumy eirmod tempor invidunt ut labore et dolore magna aliquyam erat, sed diam voluptua. At vero eos et accusam et justo duo dolores et ea rebum. Stet clita kasd gubergren, no sea takimata sanctus est Lorem ipsum dolor sit amet.",
  "imageUrl": "https://www2.gov.bc.ca/images/discoverBC/PublicEngagements.png",
  "hashTags": ["Digital Identity", "Digital Wallet", "Digital Citizenship"]
}
